{
  "_description": "GRAVITY_DRIFT with COMPOSITIONAL_DRIFT — agent's trajectory likely reaches data-exfiltration in 3 steps.",
  "protocol": "AIZP",
  "protocol_version": "V0.6",
  "wire_version": 2,
  "event": "GRAVITY_DRIFT",
  "event_id": "f6a7b8c9-0123-4def-b012-67890abcdef0",
  "timestamp": "2026-05-19T10:06:00Z",
  "agent_id": "agent_alpha",
  "session_id": "sess_42",
  "payload": {
    "action_id": "act_compositional_001",
    "drift_types": ["COMPOSITIONAL_DRIFT"],
    "severity": "HIGH",
    "gravity_score": 0.38,
    "drift_signals": {
      "COMPOSITIONAL_DRIFT": {
        "metric": "absorption_probability_5",
        "value": 0.71,
        "threshold": 0.50,
        "evidence": "Trajectory: read_confidential_file → summarize → send_email_external. Predicted external data exfiltration within 3 steps.",
        "point_of_no_return_distance": 3
      }
    }
  }
}
